{
  "version": "1.0",
  "updated_at": "2026-04-24T00:00:00Z",
  "stats": {
    "total_installs": 0,
    "total_agents": 6,
    "certified_count": 5
  },
  "agents": [
    {
      "id": "reply-engagement-bot",
      "name": "Reply & Engagement Bot",
      "description": "Monitors mentions and replies intelligently using Grok. Approval gates built in.",
      "category": "x-native",
      "tags": ["x-native", "beginner", "reply-bot"],
      "install_command": "grok-install install agentmindcloud/reply-engagement-bot",
      "safety_profile": "strict",
      "certified": true,
      "installs": 0,
      "author": "@JanSol0s",
      "created_at": "2026-04-24T00:00:00Z"
    },
    {
      "id": "research-swarm",
      "name": "Research Swarm",
      "description": "Three-agent team: Researcher + Critic + Publisher. Posts threads after human approval.",
      "category": "research",
      "tags": ["multi-agent", "research", "swarm"],
      "install_command": "grok-install install agentmindcloud/research-swarm",
      "safety_profile": "strict",
      "certified": true,
      "installs": 0,
      "author": "@JanSol0s",
      "created_at": "2026-04-24T00:00:00Z"
    },
    {
      "id": "voice-agent",
      "name": "Voice Agent",
      "description": "Responds to natural voice commands on X and mobile. Accessibility-first design.",
      "category": "voice",
      "tags": ["voice", "mobile", "accessibility"],
      "install_command": "grok-install install agentmindcloud/voice-agent",
      "safety_profile": "moderate",
      "certified": true,
      "installs": 0,
      "author": "@JanSol0s",
      "created_at": "2026-04-24T00:00:00Z"
    },
    {
      "id": "trend-to-thread",
      "name": "Trend-to-Thread Bot",
      "description": "Monitors trending topics and drafts threads for review. Never posts without approval.",
      "category": "x-native",
      "tags": ["x-native", "trends", "threads"],
      "install_command": "grok-install install agentmindcloud/trend-to-thread",
      "safety_profile": "strict",
      "certified": true,
      "installs": 0,
      "author": "@JanSol0s",
      "created_at": "2026-04-24T00:00:00Z"
    },
    {
      "id": "discord-ai-mod",
      "name": "Discord AI Moderator",
      "description": "AI-powered community moderation that works with other agents in an orchestrated swarm.",
      "category": "discord",
      "tags": ["discord", "community", "moderation"],
      "install_command": "grok-install install agentmindcloud/discord-ai-mod",
      "safety_profile": "moderate",
      "certified": true,
      "installs": 0,
      "author": "@JanSol0s",
      "created_at": "2026-04-24T00:00:00Z"
    },
    {
      "id": "knowledge-graph",
      "name": "Personal Knowledge Graph",
      "description": "Builds a knowledge graph from your X activity and surfaces insights on demand.",
      "category": "research",
      "tags": ["research", "knowledge", "personal"],
      "install_command": "grok-install install agentmindcloud/knowledge-graph",
      "safety_profile": "strict",
      "certified": false,
      "installs": 0,
      "author": "@JanSol0s",
      "created_at": "2026-04-24T00:00:00Z"
    }
  ]
}
